{
  "report_id": "rep_2026_00184",
  "slug": "webhook-reliability-platform",
  "status": "published",
  "tier_visibility": {
    "starter_available": true,
    "pro_available": true,
    "pdf_export_pro_only": true
  },
  "meta": {
    "title": "Webhook Reliability Platform",
    "subtitle": "Production-grade webhook management for indie SaaS teams",
    "category_primary": "Dev Tools",
    "category_secondary": [
      "Micro-SaaS",
      "Infrastructure"
    ],
    "geo": [
      "Global"
    ],
    "language": "en",
    "published_at": "2026-03-24",
    "updated_at": "2026-03-24",
    "report_number": 184,
    "author_mode": "system-generated",
    "version": "1.0"
  },
  "dashboard": {
    "hero_label": "Featured report",
    "hero_summary": "A reliability wedge between disposable debugging tools and expensive enterprise observability.",
    "thumbnail_theme": "devtools-dark",
    "badges": [
      "High signal",
      "Solo-friendly",
      "Fast to MVP"
    ]
  },
  "scoring": {
    "overall_confidence": 82,
    "recommendation": "build",
    "market_score": 84,
    "revenue_score": 78,
    "competition_score": 61,
    "difficulty_score": 42,
    "speed_to_mvp_score": 73,
    "founder_fit_score": 80,
    "signal_strength_score": 86,
    "scoring_notes": [
      "Strong operator pain",
      "Credible SMB wedge",
      "Moderate competition but fragmented"
    ]
  },
  "market_research": {
    "market_overview": {
      "summary": "Webhook tooling sits inside API infrastructure and reliability operations, with a widening gap between simple debugging utilities and enterprise-grade event platforms.",
      "market_definition": "Tools that help teams inspect, replay, debug, route, and audit webhook events across product and infrastructure workflows.",
      "demand_drivers": [
        "Growth of API-first products",
        "More event-driven systems",
        "Higher support cost from silent failures",
        "Increasing need for auditability"
      ],
      "timing_catalysts": [
        "AI agent workflows increase webhook complexity",
        "Postman ecosystem changes push teams to alternatives",
        "More SMB teams now run production integrations"
      ]
    },
    "market_size": {
      "tam": {
        "value": 7000000000,
        "display": "$7.0B",
        "method": "top_down_estimate"
      },
      "sam": {
        "value": 860000000,
        "display": "$860M",
        "method": "segment_filtered_estimate"
      },
      "som": {
        "value": 18000000,
        "display": "$18M",
        "method": "obtainable_share_estimate"
      },
      "assumptions": [
        "SMB developer tooling buyers are the initial target",
        "Focus is on reliability/debugging layer, not full API lifecycle",
        "Near-term obtainable share assumes focused GTM"
      ]
    },
    "buyer_urgency": {
      "level": "high",
      "summary": "Webhook failures create direct operational and support pain."
    }
  },
  "community_signals": {
    "summary": "Community pain is persistent and highly operational rather than aspirational.",
    "signal_sources": [
      "Reddit",
      "GitHub issues",
      "Developer forums",
      "Product review sites"
    ],
    "pain_points": [
      {
        "theme": "Missed events",
        "frequency": "high",
        "detail": "Users struggle to detect failed webhook deliveries before customers notice."
      },
      {
        "theme": "Replay friction",
        "frequency": "high",
        "detail": "Manual replay workflows are slow and error-prone."
      },
      {
        "theme": "Poor visibility",
        "frequency": "medium",
        "detail": "Existing tools often show logs but not enough context for root-cause analysis."
      }
    ],
    "sentiment": {
      "positive": 18,
      "neutral": 29,
      "negative": 53
    }
  },
  "competitor_insights": {
    "summary": "The category is validated, but the SMB wedge remains under-served.",
    "competitor_table": [
      {
        "name": "Hookdeck",
        "type": "incumbent",
        "positioning": "Enterprise-grade event ops",
        "pricing": "$299+/mo",
        "strength": "Deep infrastructure capabilities",
        "weakness": "Too heavy or expensive for smaller teams",
        "gap_relevance": "Leaves SMB and solo-founder wedge open"
      },
      {
        "name": "Webhook.site",
        "type": "utility",
        "positioning": "Simple debugging",
        "pricing": "$0-$19/mo",
        "strength": "Fast, easy inspection",
        "weakness": "Limited workflow depth",
        "gap_relevance": "Useful utility but not a full reliability layer"
      }
    ],
    "positioning_gap": {
      "headline": "Reliability-first tooling for smaller teams",
      "summary": "A focused replay + debugging + alerting layer remains commercially plausible."
    },
    "pricing_landscape": {
      "low_end": "$0-$19/mo",
      "mid_market": "$29-$99/mo",
      "enterprise": "$299+/mo"
    }
  },
  "strategy_frameworks": {
    "entry_wedge": {
      "headline": "Webhook replay and failure visibility",
      "summary": "Lead with the most operationally painful reliability workflow first."
    },
    "acquisition_path": {
      "primary_channels": [
        "Developer content",
        "GitHub demos",
        "Communities for API-first builders",
        "Incident-focused educational content"
      ],
      "motion": "Bottom-up developer adoption"
    }
  },
  "business_model": {
    "pricing_model": "subscription",
    "starter_price_hint": "$29/mo",
    "team_price_hint": "$79/mo",
    "enterprise_price_hint": "custom",
    "upsells": [
      "Log retention",
      "Higher event volume",
      "Team collaboration",
      "Compliance exports"
    ]
  },
  "founder_fit": {
    "best_for": [
      "Technical solo founders",
      "Small dev-tool teams"
    ],
    "less_ideal_for": [
      "Founders who dislike developer distribution"
    ],
    "sales_complexity": "medium",
    "technical_load": "medium",
    "support_burden": "medium"
  },
  "risk_matrix": {
    "overall_risk": "moderate",
    "risks": [
      {
        "type": "commoditization",
        "severity": "medium",
        "summary": "Could be perceived as a feature rather than a standalone product."
      },
      {
        "type": "wedge_failure",
        "severity": "high",
        "summary": "If positioning is too broad, the product loses clarity."
      }
    ]
  },
  "case_examples": {
    "success_patterns": [
      {
        "title": "Infrastructure wedge success",
        "summary": "Focused dev tools often win by solving one operational pain deeply before expanding."
      }
    ],
    "failure_patterns": [
      {
        "title": "Too broad too early",
        "summary": "Products that try to become a full platform too early lose positioning clarity."
      }
    ]
  },
  "roadmap_30d": {
    "week_1": [
      "Interview 15-20 API-first teams",
      "Validate replay/debugging pain"
    ],
    "week_2": [
      "Build landing page and positioning test",
      "Create CLI or debugging demo"
    ],
    "week_3": [
      "Run outreach in dev communities",
      "Collect signups and product feedback"
    ],
    "week_4": [
      "Ship MVP reliability workflow",
      "Test paid conversion from early users"
    ]
  },
  "verdict": {
    "final_call": "build",
    "summary": "A credible SMB wedge exists if the product stays tightly focused on replay and failure visibility.",
    "next_best_action": "Validate urgency with smaller API-first teams before broadening scope."
  },
  "visuals": {
    "trend_chart": {
      "type": "line",
      "series": [
        22,
        28,
        31,
        39,
        44,
        58,
        73,
        87
      ],
      "x_labels": [
        "Q1",
        "Q2",
        "Q3",
        "Q4",
        "Q5",
        "Q6",
        "Q7",
        "Q8"
      ],
      "label": "Signal trajectory"
    },
    "score_bars": [
      {
        "label": "Market",
        "value": 84
      },
      {
        "label": "Revenue",
        "value": 78
      },
      {
        "label": "Competition",
        "value": 61
      },
      {
        "label": "Difficulty",
        "value": 42
      }
    ]
  },
  "starter_view": {
    "visible_sections": [
      "meta",
      "dashboard",
      "scoring",
      "market_research.market_overview",
      "community_signals.summary",
      "community_signals.pain_points",
      "competitor_insights.summary",
      "verdict"
    ],
    "locked_sections": [
      "market_research.market_size",
      "competitor_insights.competitor_table",
      "competitor_insights.pricing_landscape",
      "strategy_frameworks",
      "business_model",
      "case_examples",
      "roadmap_30d",
      "visuals.trend_chart"
    ],
    "pdf_export": false
  },
  "pro_view": {
    "visible_sections": [
      "meta",
      "dashboard",
      "scoring",
      "market_research",
      "community_signals",
      "competitor_insights",
      "strategy_frameworks",
      "business_model",
      "founder_fit",
      "risk_matrix",
      "case_examples",
      "roadmap_30d",
      "verdict",
      "visuals"
    ],
    "pdf_export": true
  },
  "rendering": {
    "theme": "dark-premium",
    "layout_variant": "institutional-terminal",
    "pdf_template": "report_v2",
    "starter_template": "report_starter_v1",
    "pro_template": "report_pro_v1"
  }
}